Rating,Review,Reviewer
9,"There are some vague references to things that happen and the usual discussion about plot elements available via trailers and pre-release clips, but I have tried to remain as “spoiler-lite” as possible. As always, however, if you’re concerned about maintaining the “virgin” experience, avoid reading this until you have seen the movie.

Avengers: Infinity War knows what it wants to be and goes about pursuing that goal with relentless intensity. An exhausting 150 minutes after opening with a bang, the film concludes with a quieter, solemn moment that illustrates how this movie has done something never previously attempted by a superhero film. No, it’s not a game-changer like Deadpool or Logan. It remains firmly anchored within the “traditional” comic book milieu. But, with an unwavering devotion to spectacle and action, the film throws down a gauntlet where this kind of mass team-up is concerned.
The third Avengers movie is the 19th entry into the ongoing series set in the Marvel Cinematic Universe (MCU), and it shows that the long game is approaching its end. Avengers: Infinity War delivers a fan’s wet dream. It’s overstuffed with familiar characters; moves with breakneck speed on a obstacle-filled track that careens between New York, space, Wakanda, and other locales; and ends with a shock to the system. The battles are more visceral and brutal than we’re accustomed to seeing in PG-13 comic book fare. There are moments of pathos and comedy and things happen that I don’t dare mention until the time for spoilers has passed. There’s a sense of incompleteness surrounding the ending that will leave viewers clamoring for the next installment while praying that the filmmakers don’t undo the daring things they accomplished here. 2019’s Avengers movie will go a long way to determining how Infinity War is perceived in retrospect: the first part of a classic cinematic superhero tale or a tease that falls apart when the rest of the story is told.
To summarize the plot would be an exercise in futility. There are too many characters and too much going on. Everyone is embroiled in their own little subplot but the overarching narrative thread is that uber-villain Thanos (Josh Brolin) is coming and, unless he is stopped, he will bring with him a universal apocalypse. His goal is to collect the six so-called “Infinity Stones.” Once he gets them, he will have the power of a god and no living entity will be able to thwart him. It’s up to the Avengers, the Guardians of the Galaxy, and a variety of other non-affiliated MCU heroes to saddle up and engage Thanos and his minions before the Infinity Stones quest is completed. But the Big Bad Guy is as complete and unstoppable a character as we’ve encountered, evolving from the shadowy puppet master lurking in the background to a destroyer of worlds. Infinity War cares enough to give him a legitimate motivation. He’s not a traditional James Bond-flavored villain who’s out for power and dominion. He has a higher calling and it transforms him into a tragic figure of almost Shakespearean proportions. In this summer of Josh Brolin, the actor’s first role may be his most memorable.
The volume of characters guarantees that no one gets much screen time and a few (like Ant-Man and Hawkeye) are absent altogether. If you’re a big Tony Stark fan, know that Robert Downey Jr. clocks in more minutes than most of the actors but that’s still not a lot. Thanos appears more than any of the heroes; in some ways, this is his movie. In order to make things manageable, the characters are broken into groups. Iron Man, Spider-Man (Tom Holland), and Doctor Strange (Benedict Cumberbatch) hang out and trade quips. The Guardians – Star Lord (Chris Pratt), Gamora (Zoe Saldana), Drax (Dave Buatista), Rocket Racoon (Bradley Cooper), Brooding Teen Groot (Terry Notary), and Mantis (Pom Klementieff) – are joined by Thor (Chris Hemsworth) when they find him floating around in space. No-Longer-Captain-America (Chris Evans) returns to the fray, bringing his ex-Avengers compatriots with him. Vision (Paul Bettany) and Scarlett Witch (Elizabeth Olsen) share a few tender moments before eventually winding up in Wakanda with Black Panther (Chadwick Boseman). Bruce Banner (Mark Ruffalo) starts out the film with one group (the one he was with at the end of Thor: Ragnarok) before moving on to another then a third.
Much of the screen time is devoted to battles. Infinity War doesn’t waste a lot of time with exposition or character interaction, although there are a few nice moments, mostly early in the film. Banter is generally kept to a minimum, although Spider-Man and Iron Man trade quips even in the heat of battle.  From the first scene to the next-to-last, it’s wham-bam-pow. At times, it’s a little too much; after a while, the sameness of the fighting, even with all the spectacular CGI, borders on monotonous. You can take a bathroom break and not miss anything – they’ll still be slugging it out and blowing things up when you get back. With the stakes so high – 50% of the universe’s population is at risk - it seems odd that it comes down to characters pummeling each other. But there’s nothing truer to the comic book nature of the story than that.
Infinity War delights in throwing surprises at viewers with as much regularity as Iron Man tosses out plasma bolts. The movie is many things but predictability isn’t among its defining characteristics. It goes dark early and often; at times, it almost feels like the MCU has borrowed from the mood of Christopher Nolan’s Dark Knight trilogy (although it avoids the distressingly downbeat tone of Zach Snyder’s DCEU outings). Even the Guardians of the Galaxy aren’t their usual flippant selves – they start out that way but it doesn’t last. The apocalyptic nature of the threat has a way of sobering up even the most sarcastic of superheroes. In my review of this film’s prequel, Captain America: Civil War, I wrote the following: “Consequences, however, are disappointingly limited.” The same can’t be said of Infinity War. This movie is all about consequences – they are numerous and far-ranging.

This movie is a lot of fun, with a dash of substance thrown in for those who care to look (Thanos and his plan are allegorical). It satisfies the deep-rooted escapist desire most movie-goers experience from time-to-time with its spectacular visuals, unflagging pace, and understanding on the part of Joe and Anthony Russo of what MCU fans want from this important piece of the saga. The staunch superhero fan won’t need a morning cup of coffee before seeing Infinity War – the film offers a bigger jolt than caffeine could ever provide. As for those who are fatigued by the genre or were never interested in the first place, there’s nothing in this film that re-invents the comic book movie or morphs it into something else. The mission of Infinity War isn’t to convert the pagans; it’s to satisfy the true believers and, to that end, it succeeds admirably. Twelve months will seem like a long time to wait for the next Avengers movie to see whether the Russo Brothers craft a worthy conclusion to the story begun in Infinity War, but for at least a year we can savor where this story has taken things.",James Berardinelli
7,"It must have taken a superhuman effort to pull together this massive production, the 19th in the Marvel Cinematic Universe, which features just about every character from all the movies thus far (except, sadly, San Francisco’s Ant-Man).

Though the result could have been an unwieldy, top-heavy, all-star mess (like 1963’s “It’s a Mad Mad Mad Mad World”), “Avengers: Infinity War” is a super movie — gigantic, but with an undeniable, powerful, humanity.

The movie’s plot has been teased in Marvel movies for years. Galactic bad guy Thanos (Josh Brolin) is attempting to collect six Infinity Stones; when he does, he can control everything, ending the universe.

It’s an old plot, but it has gravity. Like Killmonger in “Black Panther,” Thanos has his reasons, thinking his actions are for the good of all, even if they come with a vicious price.

As the movie goes on, the weight of Thanos’ task becomes heavier, and Brolin’s canny mo-cap performance makes the character almost touching.
It would be ludicrous to describe the events, except to warn that it’s more or less required to have seen last six movies in the franchise to get what’s going on.

Suffice to say, the screenplay by Christopher Markus and Stephen McFeely divides the pack of superheroes into smaller groups, which are more easily managed.

Roll call, in alphabetical order by superhero name, goes like this: Black Panther (Chadwick Boseman), Black Widow (Scarlett Johansson), Captain America (Chris Evans), Doctor Strange (Benedict Cumberbatch) and Falcon (Anthony Mackie).

The Guardians of the Galaxy are: Star-Lord (Chris Pratt), Gamora (Zoe Saldana), Drax (Dave Bautista), Nebula (Karen Gillan), Mantis (Pom Klementieff), Rocket (Bradley Cooper) and surly teen Groot (Vin Diesel).

Then: Hulk (Mark Ruffalo), Iron Man (Robert Downey Jr.), Scarlet Witch (Elizabeth Olsen), Spider-Man (Tom Holland), Thor (Chris Hemsworth), Vision (Paul Bettany), War Machine (Don Cheadle), and the former “Winter Soldier,” Bucky Barnes (Sebastian Stan).

The list includes others: Danai Gurira, Letitia Wright, Tom Hiddleston, Idris Elba, Benicio Del Toro, Gwyneth Paltrow, Peter Dinklage, Winston Duke, Benedict Wong, etc.

At one point, Spider-Man, while trying to help colleagues, gives up and says, “I’m sorry… I can’t remember all your names.”

Humor — carried over from funnier entries like “Guardians of the Galaxy” and “Thor: Ragnarok” — is welcome, and nicely interspersed with more dramatic moments.
Meanwhile, brother directors Anthony and Joe Russo (of the Captain America movies “The Winter Soldier” and “Civil War”) keep up a snappy, coherent pace.

In the past, the Russos have been camera-shakers, and they still occasionally tend toward the too-quick cut, but they have improved. “Avengers: Infinity War” is their smoothest, best looking movie yet.

What’s different here is that there are consequences. Losses mean something, and it’s disquieting.

These characters have been onscreen for 10 years, since 2008’s “Iron Man,” and even longer on the comic page. Why do we care about them so much?

The answer could be twofold. Superheroes appeal to geeky, awkward kids because of the promise that underneath a misfit exterior lies a special power, if only others could see it.

In today’s troubled world, they also appeal to adults because they use powers to help others. It’s comforting to think that any of us would do the same, if we could.

While not perfect, superheroes are our best possible selves, freed and visualized.",JEFFREY M. ANDERSON
7,"Considered on its own, as a single, nearly 2-hour-40-minute movie, “Avengers: Infinity War” makes very little sense, apart from the near convergence of its title and its running time. Early on, someone menacingly (and presciently) says, “You may think this is suffering. No: It’s salvation.” That’s a bit overstated either way. It’s puzzlement and irritation and also, yes, delight. But of course this film, the 19th installment in a series, was never meant to be viewed or judged in isolation. In that respect it shouldn’t really be thought of as a movie at all, at least in the ways people with jobs like mine are accustomed to using the word. Which poses a few difficulties, for me and also, I would argue, for you.

Directed by Joe and Anthony Russo, scrappy fraternal climbers up the 21st-century Hollywood ladder, “Infinity War” is a chunk of matter in the Marvel Cinematic Universe, a vast entity that long ago expanded beyond the usual boundaries of sequelization and brand extension. This synergistic expression of the corporate interests of Marvel Studios and the Walt Disney Company — which now include 19 feature films and much else besides — has come to be less a creative or commercial undertaking than an immutable fact of life, like sex or the weather or capitalism itself.
That makes the franchise hard to criticize. You can’t really be for or against Marvel (in spite of the conspiracy theories of some DC fans), and you can’t quite opt out of it either. They don’t call it a universe for nothing: Where else are we going to go? So we make our zigzagging ways, picking out our favorite planets and solar systems, accepting a baseline of tedious, standardized dead space that makes the brighter constellations seem disproportionately fresh and surprising. “Guardians of the Galaxy” was so funny and weird. Not like a superhero movie at all. Same with “Thor: Ragnarok.” Captain America is such a complicated guy. “Black Panther” gave audiences so much to root for and talk about.
Those interesting, unusual specimens — what we used to think of, in simpler times, as “good movies” — aren’t exactly accidents. They are carefully planned exceptions that uphold a rule (meaning a regime as well as a norm) of passive acceptance disguised as enthusiasm. This universe is engineered for variety and inclusiveness, within certain strict parameters. Above all, the Disney-Marvel combination is a giant machine that manufactures maximum consent. The cosmos is theirs. The rest of us just live in it.

I’m not complaining, but rather pointing out how pointless, how silly it sounds when anyone bothers to venture a complaint. Who wants to be a hater? Still, it’s worth noting that the ascendance of Marvel (and of other, not quite as universal entities like it) has narrowed the parameters of criticism. I’m supposed to tell you, in this review, how much fun you’ll have at “Infinity War.” (Yes, you will have some. Will you have enough? Almost.) But I’ve probably already gone too far in trying to think about what it means. The Marvel movies and others of their kind often produce an illusion of profundity, a slick, murky overlay of allegorical suggestiveness. This provides grist for the kind of think pieces that spar with one another — “Infinity War” is liberal; no, it’s conservative; but don’t you see that it’s a protest against Trump; actually, it’s an attack on the tyranny of political correctness — until they catalyze the inevitable anti-intellectual backlash. It’s just a movie! Don’t spoil the fun!

And of course it is with respect to “spoilers” that the policing of discourse is most ruthlessly and effectively practiced. Reviewers who attend advance screenings take a vow of silence about plot details that will be widely known within a week and all but forgotten a week after that. Government secrets are guarded with less care, and requests from public officials to go off the record are addressed with more skepticism. But if I mention which superhero dies, or which one has an unexpected relationship with someone else — well, I wouldn’t dream of it. Not because I’m afraid of Disney executives. It’s the wrath of their obedient, weaponized minions I fear. In other words: you.

This is not a healthy situation. The reasonable concern that major plot elements not be divulged has spawned a phobic, hypersensitive taboo against public discussion of anything that happens onscreen. If, for example, I were to share that Thor (Chris Hemsworth) mistakes Rocket (Bradley Cooper), who is a raccoon, for a rabbit — whoops, you already hit “send,” didn’t you? The joke is repeated a half-dozen times, so it kind of ruins itself. And until the end, the whole thing is weirdly free of any but the most superficial, mechanical surprises.
The action is especially tedious and predictable. I mean both the scenes of fighting and flying and the overall rhythm of the first two hours or so. People talk for a while, sprinkling jokes and morsels of personality into the heavy dough of exposition. Then they fight in the usual way, by throwing giant objects (and one another) and shooting waves of color from their hands. The noisy, bloated spectacles of combat were surely the most expensive parts of the movie, but the money seems less like an imaginative tool than a substitute for genuine imagination.
There is so much to explain, but basically a large purple fellow named Thanos (Josh Brolin) wants, on vague Malthusian principles, to wipe out half the life in the universe. As you try to keep track of all the good guys massed against him, you may decide he has a point. But he’s not a bad villain. I mean, he’s very bad, but his malevolence is laced with melancholy, and there is a ghastly grandeur to his ambition.

To fulfill his evil plans, Thanos needs to collect six “infinity stones,” which in spite of their awesome power look a lot like what you would find in the craft kit you have been meaning to regift since your kid’s seventh birthday. Also, come on: Another quest for magic gewgaws? This one lumbers from Vormir to Knowhere to Titan, with terrestrial stops in New York, Scotland and Wakanda. Along the way, Tony Stark (Robert Downey Jr.) and Doctor Strange (Benedict Cumberbatch) stage a Sherlock Holmes meta-duel and compare goatees. The hunky-Chris showdown — Hemsworth vs. Pratt (Peter Quill) vs. Evans (Captain America) — ends in a three-way tie. Zoe Saldana is heartbreaking as Gamora. If you end up wanting more Black Panther (Chadwick Boseman) or Black Widow (Scarlett Johansson) or War Machine (Don Cheadle), or whoever your favorite happens to be — well, that’s kind of the idea, isn’t it?

But where you end up may not be where you thought this was going. The final act, including the post-credits sting (to infinity and beyond, as it were) brings a chill, a darkness and a hush that represent something new in this universe. “Infinity War” is the first half of the final installment in the series, and it concludes with a premonition of finality. Its intimations of grief and terror feel shrewdly attuned to what is happening in the actual, unmarvelous world. But those emotions can also be folded back into the movies themselves. This universe is coming to an end. And then where will we be?", A.O. Scott
8,"If a movie can be defined by the strength of its villain, Avengers Infinity War is a giant. Towering over the spectacle is Josh Brolin's evil despot Thanos, whose striking capture motion performance and physicality comes close to stealing the film. He's a gigantic, power hungry warlord with a chin sculpted like overlong piano keys. He reveals an unexpectedly soulful side, too.

The film is an extravagant mash-up - a dense tapestry into whose digital fabric our Marvel superhero favourites are woven. It's a frenzy of fun and action and directors Anthony Russo and Joe Russo have directed this operatic aria with energy and humour.

Ten years in the making, the film is a celebration of 10 years of Marvel's Cinematic Universe and 18 films; beginning with Ironman (2008) and ending with Black Panther (2018). At the worldwide box office, it represents a collective total of $13 billion dollars.

The plot involves Thanos' mission to collect the six Infinity Stones (different coloured baubles representing the elements of Mind, Soul, Power, Space, Reality and Time) so he can erase half the universe.

The integration of superheroes including Robert Downey Jr's Iron Man, Chris Hemsworth's Thor, Benedict Cumberbatch's Doctor Strange, Tom Holland's Spider-Man, Chris Evans' Captain America is no mean feat. There's humour as Mark Ruffalo's Bruce Banner struggles to morph into his green counterpart The Hulk. Add Chadwick Boseman's Black Panther in Wakanda and Zoe Saldana's glamorous Gomora plus her android half-sister Nebula (Karen Gillan), whose link to Thanos is key to the plot. I like the way the filmmakers play with proportion and perspective: Peter Dinklage's Eitri fills the screen.

My favourites moments involve Rocket ('the rabbit'; Bradley Cooper) and Groot ('I am Groot'; Vin Diesel) from The Guardians. They are adorable and offer priceless moments. As we watch our favourite superheroes do their bit in the conflict that follows, it is hard at times to know who is fighting whom. But it doesn't seem to matter as we emotionally leapfrog from one reality to the next. Action with a Capital A.

Frenetic signposts lead us to the climactic sequences. There are surprises and shocks and there will be many different reactions to the film's ending. Let me simply say this: there is more to come.
",Louise Keller
