Rating,Review,Reviewer
9,"For their 19th film, the Marvel Cinematic Universe is looking to shake things up in a significant way. Marvel Studios has adhered to formula before, building a brand name with superhero feats of strength and crisis-solving, spinning an intricate web of characters and motivations. With “Avengers: Infinity War,” the company is looking to add a more pronounced element of surprise, uniting all the big names and fringe players for battle against a powerful foe, and one who’s capable of wiping out the universe with the snap of his fingers. Directors Joe and Anthony Russo try to make the specialty of the community effort unique, generating a sprawling epic that crosses galaxies and takes lives, ordering up towering action sequences and primal emotions, delivering the most psychologically complex MCU event yet. “Infinity War” isn’t concerned with endings, but as set-ups go, it’s a humdinger, going apocalyptic while still retaining familiar beats of humor, heart, and body-smashing confrontations.
The Avengers have disbanded, experiencing separate and joint adventures around the world and beyond. However, new focus on saving the galaxy is critical to the defeat of Thanos (Josh Brolin), a God-like ruler who’s close to acquiring the Infinity Stones, affixing them to his gauntlet of power. If he collects all six stones, his mission to balance the universe, killing countless in the process, will be achieved. Setting out to stop this seemingly unstoppable evil are Doctor Strange (Benedict Cumberbatch), Iron Man (Robert Downey Jr.), and Spider-Man (Tom Holland), who find themselves visiting Thanos’s home world; Star-Lord (Chris Pratt), Drax (Dave Bautista), Gamora (Zoe Saldana), Mantis (Pom Klementieff), Rocket (Bradley Cooper), and Groot (Vin Diesel), who are thrust into the fight when they pick up Thor (Chris Hemsworth) in space; Vision (Paul Bettany) and Scarlet Witch (Elizabeth Olson), who are trying to remain out of sight in Scotland; and Bruce Banner (Mark Ruffalo), who’s witnessed Thanos’s strength, teaming with Captain America (Chris Evans), Black Widow (Scarlett Johansson), Falcon (Anthony Mackie), and Black Panther (Chadwick Boseman) to stand against this unusually contemplative threat.

While it’s not a revolutionary superhero movie, “Infinity War” pays careful attention to Thanos and his mission to acquire the infinity stones. He’s a hulking purple creature with a plan to kill a significant amount of people around the universe, but there’s a method to his madness, with the screenplay identifying his concerns about the balance of life, with overpopulation a primary concern, willing to thin herds everywhere to restore a little sanity and protect natural resources. The idea here is that Thanos doesn’t believe he’s in the murder business, instead acting nobly to salvage what’s left of the living world, using the immense power of the Stones to carry out his culling, with a specific connection made between the villain and Gamora, his adopted daughter who hates him most of all. Brolin’s sensational here, keeping Thanos a measured creature with deep-seated concerns about his endgame, genuinely confused as to why there are those out there trying to stop him. Such psychological weight doesn’t prevent Thanos from becoming an intimidating heavy, but a good chunk of the 149 minute run time is set aside for the titan as he struggles with concepts of sacrifice and power, all the while swatting down challenges to his throne from the superheroes, with help provided by four determined henchmen who make their own messes with enormous spaceships and weapons.
Thanos is the big draw of “Infinity War,” but the essentials of the MCU are represented, once again building on what’s come before. The warriors were scattered after the events of “Captain America: Civil War,” but the new film rounds up the old crew, with the writing juggling a handful of side missions that permit the Russos time to play with established personalities and develop new wrinkles in the unfolding story. Perhaps most inspired is the union of Thor and the Guardians of the Galaxy, with Star-Lord immediately threatened by the new arrival, who eventually teams up with the “rabbit” (Rocket) and the “tree” (Groot, who’s now a videogame-loving teenager) to forge a new weapon for himself, helping to channel his supercharged powers developed in “Thor: Ragnarok.” Banter is strong here, adding some needed humor to the solemn journey, with Bautista once again stealing scenes as the lovably blunt Drax, while Hemsworth clearly relishes the change in scene partners. It’s Gamora who’s gifted the largest arc of the heroes, struggling with her position as Thanos’s adopted daughter, witnessing his deadly march across the cosmos while in possession of key information that could alter his Infinity Stone scavenger hunt.

The Avengers have disbanded, experiencing separate and joint adventures around the world and beyond. However, new focus on saving the galaxy is critical to the defeat of Thanos (Josh Brolin), a God-like ruler who’s close to acquiring the Infinity Stones, affixing them to his gauntlet of power. If he collects all six stones, his mission to balance the universe, killing countless in the process, will be achieved. Setting out to stop this seemingly unstoppable evil are Doctor Strange (Benedict Cumberbatch), Iron Man (Robert Downey Jr.), and Spider-Man (Tom Holland), who find themselves visiting Thanos’s home world; Star-Lord (Chris Pratt), Drax (Dave Bautista), Gamora (Zoe Saldana), Mantis (Pom Klementieff), Rocket (Bradley Cooper), and Groot (Vin Diesel), who are thrust into the fight when they pick up Thor (Chris Hemsworth) in space; Vision (Paul Bettany) and Scarlet Witch (Elizabeth Olson), who are trying to remain out of sight in Scotland; and Bruce Banner (Mark Ruffalo), who’s witnessed Thanos’s strength, teaming with Captain America (Chris Evans), Black Widow (Scarlett Johansson), Falcon (Anthony Mackie), and Black Panther (Chadwick Boseman) to stand against this unusually contemplative threat.

While it’s not a revolutionary superhero movie, “Infinity War” pays careful attention to Thanos and his mission to acquire the infinity stones. He’s a hulking purple creature with a plan to kill a significant amount of people around the universe, but there’s a method to his madness, with the screenplay identifying his concerns about the balance of life, with overpopulation a primary concern, willing to thin herds everywhere to restore a little sanity and protect natural resources. The idea here is that Thanos doesn’t believe he’s in the murder business, instead acting nobly to salvage what’s left of the living world, using the immense power of the Stones to carry out his culling, with a specific connection made between the villain and Gamora, his adopted daughter who hates him most of all. Brolin’s sensational here, keeping Thanos a measured creature with deep-seated concerns about his endgame, genuinely confused as to why there are those out there trying to stop him. Such psychological weight doesn’t prevent Thanos from becoming an intimidating heavy, but a good chunk of the 149 minute run time is set aside for the titan as he struggles with concepts of sacrifice and power, all the while swatting down challenges to his throne from the superheroes, with help provided by four determined henchmen who make their own messes with enormous spaceships and weapons.

Thanos is the big draw of “Infinity War,” but the essentials of the MCU are represented, once again building on what’s come before. The warriors were scattered after the events of “Captain America: Civil War,” but the new film rounds up the old crew, with the writing juggling a handful of side missions that permit the Russos time to play with established personalities and develop new wrinkles in the unfolding story. Perhaps most inspired is the union of Thor and the Guardians of the Galaxy, with Star-Lord immediately threatened by the new arrival, who eventually teams up with the “rabbit” (Rocket) and the “tree” (Groot, who’s now a videogame-loving teenager) to forge a new weapon for himself, helping to channel his supercharged powers developed in “Thor: Ragnarok.” Banter is strong here, adding some needed humor to the solemn journey, with Bautista once again stealing scenes as the lovably blunt Drax, while Hemsworth clearly relishes the change in scene partners. It’s Gamora who’s gifted the largest arc of the heroes, struggling with her position as Thanos’s adopted daughter, witnessing his deadly march across the cosmos while in possession of key information that could alter his Infinity Stone scavenger hunt.

Already in charge of two “Captain America” sequels, the Russos know how to play in the blockbuster sandbox, choreographing a series of matches between the Avengers and Thanos and his goons, keeping up visceral highlights by focusing on superpowers and flying bodies crashing into walls. It’s a violent feature, but the scale of the chaos is impressive, with the helmers laboring to make “Infinity War” live up to its position as a culmination of the entire MCU, staging major chases, clashes between raging armies, and feisty personality conflicts to butter up the event. There’s plenty of exposition as well, perhaps too much, with wind-down periods scattered around the picture, allowing the production to catch its breath and build to the next explosion of fury, or perhaps a showcase for new outfits, with Iron Man and Spider-Man utilizing the power of shiny nanobot technology to keep them safe from harm.
“Infinity War” travels from location to location, ending up in a few familiar places (including a return to Wakanda mere months after the release of “Black Panther”), and it juggles a large ensemble of characters with startling success, using themes of love and sacrifice to bind the group closer together, giving the comic book soap opera some consequence, especially between the secret lovers in the group. “Infinity War” does conclude with a cliffhanger (the follow-up is due next summer), ending the picture on a slightly underwhelming note, but the Russos and the MCU are creating something expansive and surprising here that genuinely thrills and chills for what’s actually the first half of battle royal I’m positive most fans won’t ever want to see the end of.
",Brian Orndorf
7,"Even with a very large cast of characters, this superhero action movie is plenty of fun...

Avengers: Infinity War is the third Avengers movie, where superheroes and villains from various films of the Marvel Cinematic Universe form an ensemble cast to present an epic battle between good and evil. What makes this one noteworthy is that there are so many characters in this one, certainly more than the first two Avengers movies. I mean, just look at the poster for this movie. If Marvel Studios keeps this up, the poster for a future Avengers movie might use up every square inch to show the faces of every character, not to mention the names of each major cast member. So naturally, you might wonder how you could possibly enjoy a movie like this one because of the huge cast. That is why I am presenting this review of Avengers: Infinity War in a format that departs from the usual: as a list of potentially frequently asked questions about this movie and how I would answer each one.

QUESTION: Is it difficult to keep track of each character in Avengers: Infinity War?

 


ANSWER: Thankfully, no. This is not a movie where each character has one distinct plotline so that there are more than 10 to follow. (Then again, can any average person follow more than 10 simultaneous plotlines?) This is a movie where various superheroes come together and end up working in different teams. This makes things much easier. Now you have one plot thread per group of characters instead of one plot thread per character. For example, one group includes Iron Man, Doctor Strange, and Spider-Man, while Thor, Rocket, and Groot form another, and Star-Lord, Gamora, and Drax split off in different directions. Sometimes a group loses one member and gains another. The point is that you should be able to keep track of the character groups and their plot threads.

This leads me to the following observation. Even though multiple Marvel heroes appear here, a considerable amount of screen time is dedicated to the Guardians of the Galaxy. That's because the villain in this movie is Thanos, and I am even going as far as to say that you might want to watch this movie partly for the continuation of the Guardians of the Galaxy saga. Of course, if Marvel does make a third Guardians movie, I'm willing to bet that you can watch that one without knowing the events of Avengers: Infinity War. I say all of this just so you have an idea of how much representation certain characters get. But don't worry. The other characters have plenty of screen time, too.

QUESTION: Do you need to see any previous Marvel Cinematic Universe movie before this one?

 


ANSWER: Not really. It is true that Marvel fans who have seen every single Marvel Cinematic Universe movie once (or multiple times if they are die-hard fans) will appreciate seeing connections between those movies and Avengers: Infinity War. But seeing those other movies only serves to enhance enjoyment of this one. It's not a requirement to enjoy this movie or to understand certain plot elements within.

Put it this way. Whenever you see something on screen that no doubt has a backstory in another Marvel movie, all you need to do is focus on what happens going forward. You will find that no backstory is needed for any of the characters. Yes, even if you have never seen any Marvel movie prior to this one, you can still enjoy Avengers: Infinity War. Don't feel left out if you lack knowledge of things like why Thor has a missing eye or the circumstances of Steve Rogers not being Captain America anymore. The writers, I'm sure, took you into account.

QUESTION: When you have one massive crossover of characters, does anything clash and feel unnatural as a result?

ANSWER: It's natural to be wary of fictional crossovers because you don't know if the elements of each fictional work will meld well with each other or feel unnatural with each other. With the Marvel Cinematic Universe, however, there is no need to worry about that at all. When you have a single fictional setting for multiple story series, the writers will undoubtedly take everything in that setting into account when developing a story for specific characters. With this kind of fiction, crossovers aren't just easy to do. They're intended and planned well in advance.

One of the cool things about the Avengers movies, not just this one, is how each featured superhero has unique abilities to fight and defend. This allows action scenes to have different kinds of weapons being wielded and different superhuman powers to use. For example, early in Infinity War, you have Iron Man's nanotech metal suit, flight ability, and explosive weaponry used alongside Spider-Man's agility and versatile web-producing ability and Doctor Strange's power of creating portals. Now and then, you can see the superhero powers helping one another out.

Besides the action, there is no crossover clash when it comes to thrills and subtle humor. The individual Marvel movies have those already, so making a combined Marvel movie is a piece of cake.

QUESTION: How complex is the plot of this movie?

ANSWER: It's really not. All it involves is Thanos seeking all six Infinity Stones in order to have the power to control the universe, and the many Marvel heroes we've come to know and love now have to work together and stop Thanos. I'm willing to believe that it's a challenge for the writers to develop a complex intricate plot when there are so many characters to keep track of. Not that it's possible. It can be done, but extra work is required because you need to connect many characters to the story.

QUESTION: So is this movie really just another standard superhero action movie?

 


ANSWER: Yes and no. Much of Avengers: Infinity War is standard superhero fare because of the action and sci-fi/fantasy elements. But one thing prevents it from being 100% run-of-the-mill: the villain. At first, you might think that Thanos is a mad power-hungry brute who just hates everything. But if you wait, you will get to moments where you learn the motive underlying Thanos's desire for the Infinity Stones. That part of the movie is a reminder that the other side of an argument may still have something sensible and rationale, even if you ultimately cannot join the other side. More importantly, it shows that Thanos is perhaps more of a character who has good intentions but also misguided ideas, rather than a ruthless character with no heart.

Then there is the finale. All I am going to suggest is to throw all good-guy-versus-bad-guy conventions out the window. This movie deserves credit for willingness to deliver the unexpected and shake things up.

QUESTION: What would you say is the core appeal of this movie? Is it characters you care about? A story that is well written?

ANSWER: It's really just the fun action and special effects. To a certain degree, it's fun to follow the story and see what happens to each character, because it's not like plot and characters are nonexistent. They just aren't the major elements of Avengers: Infinity War.

QUESTION: Is this the end of the Avengers series?

ANSWER: Definitely not. Another one is coming out a year after this one. That should be a real welcome after you see how Infinity War ends.

QUESTION: Is Avengers: Infinity War worth seeing?

ANSWER: Based on what I've described, yes. The action is simply a lot of fun. The basic level of plot and character development prevents me from giving it my highest rating, but at least it provides a context for the action. As for where on my 1-to-10 scale this movie falls, it had been close a 9 at certain points, but it was, in retrospect, closer to an 8 most of the way, so that's where I put it. I would also like to take a moment to congratulate Marvel Studios for its 10th anniversary of cranking out movies of the Marvel Cinematic Universe. Avengers: Infinity War is certainly a good way to mark that milestone.",Anthony
6,"Now that we have a film with nearly every Marvel character that has appeared in film on the clock, it’s hard to avoid being reminded of some of the earliest films that really got this ball rolling. Unfortunately, looking back at efforts like Iron Man and Captain America: The First Avenger make it difficult to figure out how we got so far off track in point and purpose over the course of a decade. From films that cared about their characters and delivered an actual story to the deepest reaches of Michael Bay-esque destruction porn in what is apparently a series of calculated moves designed to get us here.

Fresh off the adventures of their respective films, a variety of superheroes are alerted, by Bruce Banner, that Thanos is coming to Earth in his quest to collect all the infinity stones. Banner, having been launched across the galaxy into Dr. Strange’s living room, is going to need to get everyone on board with their new focus of attention, which is an endeavor somewhat stymied by the facts that the Avengers have split into factions and sort of tried to off each other, and no one knows the Guardians of the Galaxy yet.
The film smashes all our favorites together in one of the most glorious fan-service vehicles to ever come along and throws in a collection of villains that no one knows, which means you can’t exactly argue that they aren’t supposed to have a certain magical power. It all gels into one of the best roller coasters you’ve had the pleasure of experiencing. Unfortunately, roller coasters don’t have stories.

While certain superhero films in the past have given the impression that they were made by people who didn’t exactly get the source material, Avengers: Infinity War goes the further step of apparently being the work of people who actively dislike their audience and certainly don’t think much of their intelligence. From the smallest of nitpicks having to do with the consistency of the film’s world-building to any examination of the plot, nothing about the film makes the slightest bit of sense, and spinning ever deeper into the nonsensical begins to feel like it is a point of pride for the film.
One of the film’s only moments of actual comedy, which involves Peter Dinklage, who can carry anything, is something of a sign marker letting you know just how flagrant the lack of respect for the genre in general has become. In order to get the magical whatsit, that is given no explanation, that can hurt Thanos, by way of… reasons, Thor must subject himself to something that absolutely will kill him. As Dinklage’s character, Eitri, a Dwarf from magical space town where Thor’s hammer was created, tells Thor, “You will die.” Thor ultimately resigns himself to his fate, and indeed, if this can’t kill him, nothing can. With some gnashing of teeth, a spectacularly shiny display of special effects, and a singe to the beard, Thor not only lives, but is hardly the worse for wear. Perhaps more importantly, the whole “quest” turns out to be a red herring. The overall structure and delivery of the scene makes you imagine asking someone who admittedly hates comic books, “What do you think happens in comic books?”
The rest of the film misses no opportunity to dive into the answer to the question, “What do you think of people who read comic books?” Heroes have powers and abilities, or don’t, as fits the needs of a particular fight scene. Villains who were recently battling immensely powerful heroes, and winning, now rather easily fall to heroes who are either not nearly as high on the food chain, or have absolutely no power at all. Force fields that can withstand being smashed into by a spaceship can’t keep out a dog. Not only is that simply the beginning of the film’s blatant thumbing its nose at you, it doesn’t even dive into the more plot-based deliveries that it hopes it has enough shiny bits to keep you from looking at. Thanos has a henchman that is obviously fantastically more powerful than he is himself. Dr. Strange could obviously “win” this entire conflict any time he wanted. We have the power to destroy an infinity stone, despite the fact that even to put that sentence together requires a misunderstanding of most of the terms, but don’t just aim that power at Thanos.
As if it all weren’t bad enough, and you could go on forever, because every second of the film is built around something nonsensical, Thanos, a character who is rather interesting in his original form, has everything about who he is stripped away and replaced with a commercial for eco-consciousness. I’m not opposed to a Marvel film wandering a road toward generally positive ideas about sustainability, and they’ve done it before. You might find it a commendable idea that we put such ideas into a space of cultural conversation, but they seem to only be interested in connecting such ideas with psychopaths. Josh Brolin can thankfully deliver a bit of character that goes above and beyond what he’s actually given to work with, but it still doesn’t offer something to invest in.
Even considering it’s many problems, many of which may well be neither here nor there for a lot of viewers, this is a film that not only doesn’t have a story, but treads into the largely untested realm of having something akin to the opposite of a story. I mentioned that Thor’s quest for his hammer replacement is really a red herring, but this is a film put together with nothing but red herrings. The vast collection of characters here can’t all fit in one room at a time, so they are off chasing their own versions of potential solutions to Thanos himself, and/or the getting of all the infinity stones, but it is all distraction and repeated excuses to have fight scenes and/or watch something explode, implode, or get smashed to bits.
It’s a movie that can be a fun ride, if you don’t mind that it’s laughing at the fact that you showed up, but when a story only has distractions and they are only distracting you so that you don’t realize there’s nothing there to distract you from, then you’re no longer dealing with a story.",Marc Eastman
